0,1,2,3,4,5
109,Goeboex Coffee Roastery & Futsal,,Kafe,"Jl. Perumnas No.158, Kledokan, Caturtunggal, Kec. Depok, Kabupaten Sleman, Daerah Istimewa Yogyakarta 55281",2024-05-31 03:18:30
108,Minor Cofe&Comunity,,Kedai Kopi,"Ruko Malioboro city B 23, Hotel Core, Jl. Tambak Bayan, Caturtunggal, Kec. Depok, Kabupaten Sleman, Daerah Istimewa Yogyakarta 55281",2024-05-31 03:18:21
107,Carney Co,,Kafe,"Jl. Garuni II, Kledokan, Caturtunggal, Kec. Depok, Kabupaten Sleman, Daerah Istimewa Yogyakarta 55281",2024-05-31 03:18:13
106,The Bean Garden Coffee and Eatery,,Kedai Kopi,"Jl. Ring Road Utara, Pugeran, Maguwoharjo, Kec. Depok, Kabupaten Sleman, Daerah Istimewa Yogyakarta 55281",2024-05-31 03:18:04
105,Ling Lung Kopi & Eatery,,Kafe seni,"Jl. Perumnas No.50C, Kledokan, Caturtunggal, Kec. Depok, Kabupaten Sleman, Daerah Istimewa Yogyakarta 55281",2024-05-31 03:17:55
